[
  {"beat_id":"b004","ep":1,"seq":4,"world_time":"2022-06-18T09:00",
   "location":"Molipur farm, cleared field",
   "present":["rafiq","jignesh","bhavlo","labourers"],
   "witnessed_by":["rafiq","jignesh","bhavlo","labourers"],
   "hidden_from":["pankaj","village","bettor_tver"],
   "what_happened":"Jignesh is hired at 400 rupees a match and handed a Chennai Super Kings jersey.",
   "state_changes":[{"entity":"jignesh","fact":"recruited","valence":3}],
   "source_ref":"evt_molipur_2022#t2","tier":"core_canon"},

  {"beat_id":"b006","ep":2,"seq":2,"world_time":"2022-06-19T21:00",
   "location":"Rafiq's room",
   "present":["rafiq"],
   "witnessed_by":["rafiq"],
   "hidden_from":["jignesh","bhavlo","pankaj","labourers","village"],
   "what_happened":"Rafiq takes a call from the Russia-based organiser setting the required match outcomes.",
   "state_changes":[{"entity":"rafiq","fact":"taking instructions","valence":-3}],
   "source_ref":"evt_molipur_2022#t3","tier":"core_canon"},

  {"beat_id":"b009","ep":2,"seq":5,"world_time":"2022-06-20T19:30",
   "location":"Molipur farm, under halogen lamps",
   "present":["jignesh","bhavlo","labourers","pankaj"],
   "witnessed_by":["jignesh","bhavlo","labourers","pankaj","rafiq"],
   "hidden_from":["village"],
   "what_happened":"The first match is played and livestreamed. The camera never pans wide.",
   "state_changes":[{"entity":"jignesh","fact":"believes he is in a tournament","valence":4}],
   "source_ref":"evt_molipur_2022#t4","tier":"core_canon"},

  {"beat_id":"b011","ep":3,"seq":1,"world_time":"2022-06-24T20:00",
   "location":"Telegram channel",
   "present":["rafiq"],
   "witnessed_by":["rafiq"],
   "hidden_from":["jignesh","bhavlo","pankaj","labourers","village"],
   "what_happened":"Bets from Tver, Voronezh and Moscow are taken against fixed outcomes.",
   "state_changes":[{"entity":"rafiq","fact":"money arriving","valence":-2}],
   "source_ref":"evt_molipur_2022#t5","tier":"core_canon"},

  {"beat_id":"b014","ep":4,"seq":3,"world_time":"2022-06-29T20:15",
   "location":"Molipur farm, the crease",
   "present":["jignesh","bhavlo","labourers"],
   "witnessed_by":["jignesh","bhavlo","labourers","rafiq"],
   "hidden_from":["village","bettor_tver"],
   "what_happened":"Jignesh hits a clean six off the middle of the bat. Bhavlo signals a dot ball.",
   "state_changes":[{"entity":"jignesh","fact":"understands he is paid to lose","valence":-4}],
   "source_ref":"fictionalized","tier":"core_canon",
   "note":"CROSSING POINT. 20 seconds in the mainline, a whole episode in the Jignesh spinoff."},

  {"beat_id":"b018","ep":5,"seq":1,"world_time":"2022-07-05T06:00",
   "location":"Mehsana police headquarters",
   "present":[],
   "witnessed_by":[],
   "hidden_from":["rafiq","jignesh","bhavlo","pankaj","labourers","village"],
   "what_happened":"A constable receives a tip about the operation.",
   "state_changes":[],
   "source_ref":"evt_molipur_2022#t6","tier":"core_canon",
   "note":"UNWITNESSED — deliberately open canon. Any spinoff may claim this space."},

  {"beat_id":"b022","ep":5,"seq":6,"world_time":"2022-07-07T21:47",
   "location":"Molipur farm, mid-quarter-final",
   "present":["jignesh","bhavlo","labourers","pankaj","police"],
   "witnessed_by":["jignesh","bhavlo","labourers","pankaj","police","rafiq"],
   "hidden_from":["bettor_tver"],
   "what_happened":"Police raid the farm during a live broadcast.",
   "state_changes":[{"entity":"jignesh","fact":"fortnight ends","valence":-5}],
   "source_ref":"evt_molipur_2022#t7","tier":"core_canon"}
]
